{
  "title": "Spanish Basics",
  "description": "Learn fundamental Spanish vocabulary and grammar",
  "difficulty": "Easy",
  "category": "languages",
  "tags": [
    "spanish",
    "language-learning",
    "vocabulary",
    "basics",
    "beginner"
  ],
  "questions": [
    {
      "question": "How do you say 'Hello' in Spanish?",
      "choices": [
        "Hola",
        "Adiós",
        "Gracias",
        "Por favor"
      ],
      "answer": 0,
      "explanation": "Hola means 'hello' or 'hi' in Spanish. It's the most common greeting used in Spanish-speaking countries."
    },
    {
      "question": "What does 'Gracias' mean?",
      "choices": [
        "Please",
        "Thank you",
        "Sorry",
        "Goodbye"
      ],
      "answer": 1,
      "explanation": "Gracias means 'thank you' in Spanish. It's used to express gratitude, just like in English."
    },
    {
      "question": "How do you say 'Good morning' in Spanish?",
      "choices": [
        "Buenas noches",
        "Buenas tardes",
        "Buenos días",
        "Hasta luego"
      ],
      "answer": 2,
      "explanation": "Buenos días means 'good morning' in Spanish. It's used as a greeting typically until noon or early afternoon."
    },
    {
      "question": "What is the Spanish word for 'water'?",
      "choices": [
        "Leche",
        "Jugo",
        "Café",
        "Agua"
      ],
      "answer": 3,
      "explanation": "Agua means 'water' in Spanish. Note that although agua is feminine (el agua), it uses the article 'el' because it starts with a stressed 'a'."
    },
    {
      "question": "How do you say 'My name is...' in Spanish?",
      "choices": [
        "Me llamo...",
        "Yo soy...",
        "Tú eres...",
        "Él es..."
      ],
      "answer": 0,
      "explanation": "Me llamo... (literally 'I call myself...') is the most common way to introduce yourself in Spanish. You can also say 'Mi nombre es...' (My name is...)."
    },
    {
      "question": "What does 'Por favor' mean?",
      "choices": [
        "Thank you",
        "Please",
        "You're welcome",
        "Excuse me"
      ],
      "answer": 1,
      "explanation": "Por favor means 'please' in Spanish. It's an important phrase for polite requests and is used similarly to English."
    },
    {
      "question": "How do you say 'Yes' in Spanish?",
      "choices": [
        "No",
        "Tal vez",
        "Sí",
        "Nunca"
      ],
      "answer": 2,
      "explanation": "Sí means 'yes' in Spanish. Note the accent mark (í) which distinguishes it from 'si' (if)."
    },
    {
      "question": "What is the Spanish word for 'house'?",
      "choices": [
        "Coche",
        "Calle",
        "Ciudad",
        "Casa"
      ],
      "answer": 3,
      "explanation": "Casa means 'house' or 'home' in Spanish. It's a feminine noun, so you say 'la casa'."
    },
    {
      "question": "How do you say 'Goodbye' in Spanish?",
      "choices": [
        "Adiós",
        "Hola",
        "Gracias",
        "Buenos días"
      ],
      "answer": 0,
      "explanation": "Adiós means 'goodbye' in Spanish. You can also use 'Hasta luego' (see you later) or 'Hasta pronto' (see you soon)."
    },
    {
      "question": "What does '¿Cómo estás?' mean?",
      "choices": [
        "What's your name?",
        "How are you?",
        "Where are you?",
        "How old are you?"
      ],
      "answer": 1,
      "explanation": "¿Cómo estás? means 'How are you?' in Spanish (informal). The formal version is '¿Cómo está usted?'."
    }
  ]
}
