{
  "title": "Your Quiz Title Here",
  "description": "A brief description of what this quiz covers",
  "difficulty": "Medium",
  "category": "science",
  "tags": ["example", "template"],
  "questions": [
    {
      "question": "What is 2 + 2?",
      "choices": ["3", "4", "5", "6"],
      "answer": 1,
      "explanation": "2 + 2 = 4. This is basic addition."
    },
    {
      "question": "What is the capital of France?",
      "choices": ["London", "Paris", "Berlin", "Madrid"],
      "answer": 1,
      "explanation": "Paris is the capital and largest city of France."
    },
    {
      "question": "Which planet is known as the Red Planet?",
      "choices": ["Venus", "Mars", "Jupiter", "Saturn"],
      "answer": 1,
      "explanation": "Mars appears red due to iron oxide (rust) on its surface."
    }
  ]
}
